{
  "kind": "service",
  "service": {
    "origin": "https://service.example.com",
    "name": "Example Service Provider"
  },
  "trust": {
    "accepted_authorities": [
      "https://agentpass.example.com"
    ]
  },
  "endpoints": {
    "resolve_deployments": "https://service.example.com/ap/resolve-deployments",
    "init": "https://service.example.com/ap/init",
    "initialize": "https://service.example.com/ap/initialize/{token}"
  },
  "session": {
    "supports_agent_session": true,
    "requires_disclosure_banner": true
  }
}
